{
  "speaker_activity": [
    {
      "intent": "explaining",
      "confidence": 0.95
    }
  ],
  "semantic_graph": {
    "entities": [
      {
        "id": "salt",
        "name": "salt",
        "class": "chemical",
        "status": "new_explicit"
      },
      {
        "id": "sodium",
        "name": "sodium",
        "class": "chemical",
        "status": "new_explicit"
      },
      {
        "id": "chlorine",
        "name": "chlorine",
        "class": "chemical",
        "status": "new_explicit"
      }
    ],
    "relationships": [
      {
        "subject": "salt",
        "predicate": "is composed of",
        "object": "sodium and chlorine",
        "type": "composition",
        "confidence": 0.95
      }
    ],
    "quantities": []
  },
  "explicit_information": [
    "salt is sodium and chlorine"
  ],
  "explanation_state": {
    "current_topic": "salt",
    "active_concept": "salt",
    "recent_entities": [
      "salt",
      "sodium",
      "chlorine"
    ]
  },
  "timestamp": 1789293186,
  "is_partial": false,
  "text_segment": "Salt is sodium and chlorine.",
  "inferred_information": [],
  "coreference_resolutions": []
}