{
  "speaker_activity": [
    {
      "intent": "explaining",
      "confidence": 0.95
    }
  ],
  "semantic_graph": {
    "entities": [
      {
        "id": "hand",
        "name": "hand",
        "class": "body_part",
        "status": "new_explicit"
      },
      {
        "id": "left",
        "name": "left",
        "class": "direction",
        "status": "new_explicit"
      }
    ],
    "relationships": [
      {
        "subject": "hand",
        "predicate": "is_on",
        "object": "left",
        "type": "composition",
        "confidence": 0.95
      }
    ],
    "quantities": [
      {
        "entity": "hand",
        "amount": 1,
        "unit": "body_part"
      }
    ]
  },
  "explicit_information": [
    "See what I've got to all my left hand"
  ],
  "coreference_resolutions": [
    {
      "text_reference": "it",
      "resolved_entity": "hand"
    }
  ],
  "explanation_state": {
    "current_topic": "hand",
    "active_concept": "left hand",
    "recent_entities": [
      "hand",
      "left"
    ]
  },
  "timestamp": 1789377667,
  "is_partial": false,
  "text_segment": "See what I've got to all my left hand",
  "inferred_information": []
}