{
  "speaker_activity": [
    {
      "intent": "explaining",
      "confidence": 0.95
    }
  ],
  "semantic_graph": {
    "entities": [
      {
        "id": "dot",
        "name": "dot",
        "class": "physical object",
        "status": "new_explicit"
      },
      {
        "id": "hand",
        "name": "hand",
        "class": "body part",
        "status": "new_explicit"
      }
    ],
    "relationships": [
      {
        "subject": "dot",
        "predicate": "on",
        "object": "hand",
        "type": "composition",
        "confidence": 0.95
      }
    ],
    "quantities": [
      {
        "entity": "dot",
        "amount": 2,
        "unit": "dot"
      }
    ]
  },
  "explicit_information": [
    "dot",
    "hand"
  ],
  "coreference_resolutions": [
    {
      "text_reference": "it",
      "resolved_entity": "dot"
    }
  ],
  "explanation_state": {
    "current_topic": "dot placement on hand",
    "active_concept": "dot on hand",
    "recent_entities": [
      "dot",
      "hand"
    ]
  },
  "timestamp": 1789377679,
  "is_partial": false,
  "text_segment": "Dot two on my left hand.",
  "inferred_information": [
    "The speaker's physical left hand serves as the real-world spatial coordinate anchor in the camera workspace.",
    "The visual asset ('dot' marking / hologram) should be tracked and pinned directly to the surface of the left hand.",
    "2 discrete instances of 'dot' should be procedurally placed or aligned on the anchor surface.",
    "'left hand' is an observed physical anatomical surface; 'dot' is a virtual augmentation to be rendered upon it."
  ]
}