{
  "speaker_activity": [
    {
      "intent": "explaining",
      "confidence": 0.95
    }
  ],
  "semantic_graph": {
    "entities": [
      {
        "id": "hydrogen",
        "name": "Hydrogen",
        "class": "chemical_element",
        "status": "new_explicit"
      },
      {
        "id": "oxygen",
        "name": "Oxygen",
        "class": "chemical_element",
        "status": "new_explicit"
      }
    ],
    "relationships": [
      {
        "subject": "hydrogen",
        "predicate": "composition",
        "object": "oxygen",
        "type": "composition",
        "confidence": 0.95
      }
    ],
    "quantities": []
  },
  "explicit_information": [
    "Water is composed of hydrogen and oxygen."
  ],
  "explanation_state": {
    "current_topic": "Water Composition",
    "active_concept": "Hydrogen and Oxygen",
    "recent_entities": [
      "hydrogen",
      "oxygen"
    ]
  },
  "timestamp": 1789294866,
  "is_partial": false,
  "text_segment": "Water is two hydrogen and one oxygen.",
  "inferred_information": [],
  "coreference_resolutions": []
}