{
  "speaker_activity": [
    {
      "intent": "explaining",
      "confidence": 0.95
    }
  ],
  "semantic_graph": {
    "entities": [
      {
        "id": "ent_1",
        "name": "Hydrogen",
        "class": "chemical_element",
        "status": "new_explicit"
      },
      {
        "id": "ent_2",
        "name": "Oxygen",
        "class": "chemical_element",
        "status": "new_explicit"
      },
      {
        "id": "ent_3",
        "name": "Sulph",
        "class": "chemical_element",
        "status": "new_explicit"
      }
    ],
    "relationships": [
      {
        "subject": "ent_1",
        "predicate": "is_a",
        "object": "ent_2",
        "type": "composition",
        "confidence": 0.95
      },
      {
        "subject": "ent_2",
        "predicate": "is_a",
        "object": "ent_3",
        "type": "composition",
        "confidence": 0.95
      }
    ],
    "quantities": []
  },
  "explicit_information": [
    "Hydrogen",
    "Oxygen",
    "Sulph"
  ],
  "explanation_state": {
    "current_topic": "chemical elements",
    "active_concept": "elements",
    "recent_entities": [
      "ent_1",
      "ent_2",
      "ent_3"
    ]
  },
  "timestamp": 1789293926,
  "is_partial": false,
  "text_segment": "Hydrogen, Oxygen, Sulph.",
  "inferred_information": [],
  "coreference_resolutions": []
}