{
  "speaker_activity": [
    {
      "intent": "explaining",
      "confidence": 0.95
    }
  ],
  "semantic_graph": {
    "entities": [
      {
        "id": "hydrogen",
        "name": "hydrogen",
        "class": "chemical_element",
        "status": "new_explicit"
      },
      {
        "id": "water",
        "name": "water",
        "class": "chemical_compound",
        "status": "new_explicit"
      }
    ],
    "relationships": [
      {
        "subject": "hydrogen",
        "predicate": "is_part_of",
        "object": "water",
        "type": "composition",
        "confidence": 0.95
      }
    ],
    "quantities": []
  },
  "explicit_information": [
    "Hydrogen is a chemical element, and water is a chemical compound composed of two hydrogen atoms and one oxygen atom."
  ],
  "explanation_state": {
    "current_topic": "Chemistry",
    "active_concept": "Hydrogen and Water",
    "recent_entities": [
      "hydrogen",
      "water"
    ]
  },
  "timestamp": 1789294168,
  "is_partial": false,
  "text_segment": "Water is made upon two items of hydrogen and one",
  "inferred_information": [],
  "coreference_resolutions": []
}