{
  "speaker_activity": [
    {
      "intent": "explaining",
      "confidence": 0.95
    }
  ],
  "semantic_graph": {
    "entities": [
      {
        "id": "water",
        "name": "water",
        "class": "chemical compound",
        "status": "new_explicit"
      },
      {
        "id": "hydrogen",
        "name": "hydrogen",
        "class": "element",
        "status": "new_explicit"
      },
      {
        "id": "oxygen",
        "name": "oxygen",
        "class": "element",
        "status": "new_explicit"
      }
    ],
    "relationships": [
      {
        "subject": "water",
        "predicate": "composed_of",
        "object": "hydrogen",
        "type": "composition",
        "confidence": 0.95
      },
      {
        "subject": "water",
        "predicate": "composed_of",
        "object": "oxygen",
        "type": "composition",
        "confidence": 0.95
      }
    ],
    "quantities": [
      {
        "entity": "hydrogen",
        "amount": 2,
        "unit": "atom"
      },
      {
        "entity": "oxygen",
        "amount": 1,
        "unit": "atom"
      }
    ]
  },
  "explicit_information": [
    "water",
    "hydrogen",
    "oxygen"
  ],
  "coreference_resolutions": [
    {
      "text_reference": "it",
      "resolved_entity": "water"
    }
  ],
  "explanation_state": {
    "current_topic": "water composition",
    "active_concept": "hydrogen and oxygen atoms",
    "recent_entities": [
      "water",
      "hydrogen",
      "oxygen"
    ]
  },
  "timestamp": 1789376945,
  "is_partial": false,
  "text_segment": "Water is composed of two hydrogen atoms and one oxygen atom.",
  "inferred_information": []
}