{
  "speaker_activity": [
    {
      "intent": "explaining",
      "confidence": 0.95
    }
  ],
  "semantic_graph": {
    "entities": [
      {
        "id": "matty_lee",
        "name": "Matty Lee",
        "class": "person",
        "status": "new_explicit"
      }
    ],
    "relationships": [
      {
        "subject": "Matty Lee",
        "predicate": "is",
        "object": "Matty Lee",
        "type": "composition",
        "confidence": 0.95
      }
    ],
    "quantities": [
      {
        "entity": "Matty Lee",
        "amount": 1,
        "unit": "person"
      }
    ]
  },
  "explicit_information": [
    "Matty Lee"
  ],
  "inferred_information": [],
  "coreference_resolutions": [
    {
      "text_reference": "it",
      "resolved_entity": "Matty Lee"
    }
  ],
  "explanation_state": {
    "current_topic": "Matty Lee",
    "active_concept": "Matty Lee",
    "recent_entities": [
      "Matty Lee"
    ]
  },
  "timestamp": 1790227503,
  "is_partial": false,
  "text_segment": "Hello, hello, hello, hello, hello, this is Matty Lee."
}