{
  "speaker_activity": [
    {
      "intent": "explaining",
      "confidence": 0.95
    }
  ],
  "semantic_graph": {
    "entities": [
      {
        "id": "Oxygen",
        "name": "Oxygen",
        "class": "chemical_element",
        "status": "new_explicit"
      },
      {
        "id": "atom",
        "name": "atom",
        "class": "substance",
        "status": "new_explicit"
      }
    ],
    "relationships": [
      {
        "subject": "Oxygen",
        "predicate": "composed_of",
        "object": "atom",
        "type": "composition",
        "confidence": 0.95
      }
    ],
    "quantities": []
  },
  "explicit_information": [
    "Oxygen is composed of two atoms"
  ],
  "explanation_state": {
    "current_topic": "Oxygen",
    "active_concept": "Oxygen",
    "recent_entities": [
      "Oxygen",
      "atom"
    ]
  },
  "timestamp": 1789293677,
  "is_partial": false,
  "text_segment": "Oxygen is made of two atoms.",
  "inferred_information": [],
  "coreference_resolutions": []
}