{
  "speaker_activity": [
    {
      "intent": "explaining",
      "confidence": 0.95
    }
  ],
  "semantic_graph": {
    "entities": [
      {
        "id": "atom_1",
        "name": "atom",
        "class": "chemical",
        "status": "new_explicit"
      },
      {
        "id": "atom_2",
        "name": "atom",
        "class": "chemical",
        "status": "new_explicit"
      }
    ],
    "relationships": [
      {
        "subject": "atom_1",
        "predicate": "composed_of",
        "object": "atom_2",
        "type": "composition",
        "confidence": 0.95
      }
    ],
    "quantities": []
  },
  "explicit_information": [
    "An atom is composed of two atoms of the same element."
  ],
  "explanation_state": {
    "current_topic": "Atoms",
    "active_concept": "composition",
    "recent_entities": [
      "atom_1",
      "atom_2"
    ]
  },
  "timestamp": 1789293746,
  "is_partial": false,
  "text_segment": "Oxygen is made of two atoms.",
  "inferred_information": [],
  "coreference_resolutions": []
}